default,identifier,remarks,ru,pt,de,esm,fr
4 angled triangles,JGPHUD_CROSSHAIR_HITMARKERS_SHAPE_AngledTriangles,"Same as 4 triangles, but angled 45 degrees (this is what FlexiHUD was originally using)",4 наклоненных треугольника,,,,
Circle,JGPHUD_CROSSHAIR_HITMARKERS_SHAPE_Circle,"Circle, as in a ring around the crosshair. Not to be confused with ""disk""! Can be translated as ""ring""",Кольцо,,,,
Disk,JGPHUD_CROSSHAIR_HITMARKERS_SHAPE_Disk,"Disk shape, i.e. a filled circle. Not to be confused with ""circle""!",Круг,,,,
Square,JGPHUD_CROSSHAIR_HITMARKERS_SHAPE_Square,,,,,,
Diamond,JGPHUD_CROSSHAIR_HITMARKERS_SHAPE_Diamond,Just a square angled 45 degrees,,,,,
Health/armor/ammo bars around crosshair,JGPHUD_CROSSHAIR_BARS_ENABLE,Curved bars around the crosshair in the style of HL2,Индикаторы здоровья/брони/патронов вокруг прицела,Barra de vida/armadura/munição ao redor da retícula,Gesundheits-/Rüstungs-/Munitionsanzeige am Fadenkreuz,Barras de vida/armadura/munición en la mirilla,Barre de santé/armure/munitions autour du réticule
Bars size,JGPHUD_CROSSHAIR_BARS_SIZE,Option for the bars around the crosshair,Размер индикаторов,Tamanho das barras,Leistengrösse,Tamaño de las barras,Taille des barres
Bars opacity,JGPHUD_CROSSHAIR_BARS_ALPHA,Option for the bars around the crosshair,Прозрачность индикаторов,Opacidade das barras,Leistendeckkraft,Opacidad de las barras,Opacité des barres
Bars width (multiplier),JGPHUD_CROSSHAIR_BARS_WIDTH,Option for the bars around the crosshair,Ширина индикаторов (множитель),Grossura das barras,Leistenbreite (Multiplikator),Grosor de las barras (multiplicador),Largeur des barres (multiplicateur)
Numbers next to bars,JGPHUD_CROSSHAIR_BARS_TEXT,Option for the bars around the crosshair,Цифры рядом с индикаторами,Números perto das barras,Nummern neben den Leisten,Contadores,Nombres à coté des barres
Show always,JGPHUD_CROSSHAIR_BARS_ALWAYS,Option for the bars around the crosshair,Показывать всегда,Sempre mostrar,Immer anzeigen,Mostrar siempre,Toujour montrer
Auto-hide after a delay,JGPHUD_CROSSHAIR_BARS_AUTOHIDE,Option for the bars around the crosshair,Скрывать через некоторое время,Desaparecer depois de um tempo,Nach einer Weile automatisch ausblenden,Desvanecer cuando los valores no cambien,Masquage automatique après un délai
Show enemy health next to crosshair,JGPHUD_CROSSHAIR_ENEMYHEALTH,(Possible future option) Show a curved bar above the crosshair depicting the health of the enemy you're looking at,Показывать здоровье текущего противника,Mostrar vida do inimigo perto da retícula,Gegnergesundheit am Fadenkreuz anzeigen,Mostrar vida de los enemigos,Montrer la santé des ennemis près du réticule
Bars background,JGPHUD_CROSSHAIR_BARS_BKG,(Possible future option) Whether to draw a dark background behind the health/armor/ammo bars around the crosshair,Фон индикаторов,Fundo das barras,Leistenhintergrund,Mostrar fondo para las barras,Arrière-plan des barres
Health and armor bar,JGPHUD_CROSSHAIR_BARS_HP,Health/armor bar next to the crosshair (off/left/top/right/bottom),Индикатор здоровья/брони,Barra de vida e armadura,Gesundheit und Rüstung,Barra de vida y armadura,Barre de santé et d’armure
Ammo bar,JGPHUD_CROSSHAIR_BARS_AMMO,Ammo bar next to the crosshair (off/left/top/right/bottom),Индикатор патронов,Barra de munição,Munition,Barra de municiones,Barre de munition
Enemy health bar,JGPHUD_CROSSHAIR_BARS_ENEMYHP,Enemy health bar next to the crosshair (off/left/top/right/bottom),Индикатор здоровья врага,Barra de vida do inimigo,Gegnergesundheit,Barra de vida de enemigos,Barre de santé des ennemis
Left,JGPHUD_CROSSHAIR_BARS_POS_L,To the left of the crosshair,Слева,À esquerda,Links,Izquierda,Gauche
Top,JGPHUD_CROSSHAIR_BARS_POS_T,Above the crosshair,Вверху,Acima,Oben,Arriba,Haut
Right,JGPHUD_CROSSHAIR_BARS_POS_R,To the right of the crosshair,Справа,À direita,Rechts,Derecha,Droite
Bottom,JGPHUD_CROSSHAIR_BARS_POS_B,Below the crosshair,Внизу,Abaixo ,Unten,Abajo,Bas
Custom items,JGPHUD_CustomItems_TITLE,"Menu title
""Custom"" is used in the sense ""defined by the user""",Пользовательские предметы,Ítens personalizados,Eigene Gegenstände,Items personalizados,Objets personnalisés
Display custom items,JGPHUD_CustomItems_ENABLE,Whether to draw custom items (they can be specified by the user in the ITEMINFO lump for greater compatibility),Показывать пользовательские предметы,Mostrar ítens personalizados,Eigene Gegenstände anzeigen,Mostrar items personalizados,Montrer objets customisés
"This special element can draw item classes
specified in the ITEMINFO lump.",JGPHUD_CustomItems_NOTE,"Keep under 3 lines
Use physical linebreaks (alt-Enter)","Этот блок показывает предметы, добавленные через
файл ITEMINFO.","Este elemento especial pode mostrar classes
de ítens especificadas no arquivo ITEMINFO.","Dieses spezielle Element kann Gegenstandklassen
anzeigen, die im ITEMINFO lump spezifiziert sind.","Este elemento especial puede mostrar clases
personalizadas de items definidas en ITEMINFO.","Cet élément spécial peut montrer des classes
d'objets spécifiées dans le bloc ITEMINFO."
Presets,JGPHUD_Presets_Title,Title for the Presets submenu,Пресеты,,,,
load,JGPHUD_Presets_Verb_Load,"Translate as a verb (probably in infinitive form)

This is one of the actions in a submenu that appears when you click on a preset.
After that it's used as a verb and inserted in the follwing message:

Are you sure you want to <verb> preset ""presetname""?",загрузить,,,,
overwrite,JGPHUD_Presets_Verb_Overwrite,"Translate as a verb (probably in infinitive form)

This is one of the actions in a submenu that appears when you click on a preset.
After that it's used as a verb and inserted in the follwing message:

Are you sure you want to <verb> preset ""presetname""?",перезаписать,,,,
delete,JGPHUD_Presets_Verb_Delete,"Translate as a verb (probably in infinitive form)

This is one of the actions in a submenu that appears when you click on a preset.
After that it's used as a verb and inserted in the follwing message:

Are you sure you want to <verb> preset ""presetname""?",удалить,,,,
cancel,JGPHUD_Presets_Menu_Cancel,"Button to leave the Presets menu. Comes after options to load/overwrite/delete, so please user lowercase for this one as well.
The meaning is ""return to previous menu and do nothing"", so this can also be translated as ""back""",назад,,,,
"Are you sure you want to %1s preset \""%2s\""?",JGPHUD_Presets_ConfirmAction,"%1s is ""load"" or ""overwrite"" or ""delete""
%2s is the name of the preset given by the user, so it's not affected by grammar

These string tags can be moved around, but make sure that their numbers stay in the same place (e.g. if %2s needs to be placed before %1s, the numbers do NOT change).
Don't forget the escape character \ for quotation marks.","Вы точно хотите %1s пресет \""%2s\""?",,,,
"Overwrite existing preset \""%s\""?",JGPHUD_Preset_Warning_Overwrite,"Generic warning for the Presets menu
%s is the name of the preset given by the user, so it's not affected by grammar","Перезаписать пресет \""%s\""?",,,,
Preset name cannot contain whitespace,JGPHUD_Preset_Warning_Whitespace,Generic warning for the Presets menu,В названии пресета не должно быть пробелов,,,,
Cannot create preset with empty name,JGPHUD_Preset_Warning_EmptyName,Generic warning for the Presets menu,Нельзя создать пресет с пустым названием,,,,
Built-in presets,JGPHUD_Presets_Menu_BuiltIn,Title of a submenu in the Presets menu,Встроенные пресеты,,,,
User presets,JGPHUD_Presets_Menu_User,Title of a submenu in the Presets menu,Пользовательские пресеты,,,,
Save current preset,JGPHUD_Presets_Menu_Save,Command in the Presets menu that saves the current settings,Сохранить текущие настройки в пресет,,,,
Are you sure you want to reset to default settings?,JGPHUD_Presets_Menu_ResetSettingsConfirm,,Вы точно хотите сбросить настройки?,,,,
Are you sure you want to load the default preset?,JGPHUD_Presets_Menu_ResetPresetConfirm,,Вы точно хотите загрузить пресет по умолчанию?,,,,
Preset name:,JGPHUD_Presets_Menu_Name,"When the user chooses ""Save current preset"", this line appears, followed by a text input field where the user has to enter the name for their current preset.",Название пресета:,,,,
Confirm,JGPHUD_Presets_Menu_Confirm,A button the player presses after they've entered the preset name.,Подтвердить,,,,