default,identifier,remarks,ru,pt,de,esm,fr
FlexiHUD settings,JGPHUD_SETTINGS_TITLE,"FlexiHUD is the mod's name, do not localize",Настройки FlexiHUD,Configurações do FlexiHUD,FlexiHUD Einstellungen,Configuración de FlexiHUD,Configuration de FlexiHud
Display FlexiHUD,JGPHUD_GENERAL_ENABLEHUD,A simple On/Off toggle that allows to completely disable the whole HUD,Показывать FlexiHUD,Habilitar o FlexiHUD,FlexiHUD anzeigen,Habilitar FlexiHUD,Affichage de FlexiHUD
Toggle FlexiHUD key,JGPHUD_GENERAL_ENABLEHUD_BIND,An option that lets you specify a custom key that will toggle the HUD on and off,Клавиша вкл/откл FlexiHUD,Alternar a HUD,Schnelltaste für FlexiHUD,Alternar HUD,Alterner touches de FlexiHUD
General,JGPHUD_GENERAL_TITLE,Title for the general options,Общее,Geral,Allgemein,General,Géneral
Classic integer scaling (\cDhud_oldscale\c-),JGPHUD_GENERAL_OLDSCALE,"Experimental, does not need translation",,,,,
Float-point scale factor (\cDhud_scalefactor\c-),JGPHUD_GENERAL_SCALEFACTOR,"Experimental, does not need translation",,,,,
Appearance and scaling options,JGPHUD_GENERAL_APPEARANCE_TITLE,,,,,,
Background,JGPHUD_GENERAL_APPEARANCE_BACKGROUND,,,,,,
Scaling,JGPHUD_GENERAL_APPEARANCE_SCALING,,,,,,
Base FlexiHUD scale,JGPHUD_GENERAL_APPEARANCE_BASESCALE,,,,,,
Use built-in HUD scaling,JGPHUD_GENERAL_APPEARANCE_BASESCALE_DEF,,,,,,
GZDoom HUD scaling options menu,JGPHUD_GENERAL_APPEARANCE_GZDoomScalingOptions,,,,,,
HUD background style,JGPHUD_GENERAL_BACKSTYLE,General appearance of the background: either a flat color or a texture,Стиль фона,Estilo do fundo,Hintergrundstil,Estilo de fondo,Style d'arrière-plan de l’ATH
Flat color,JGPHUD_GENERAL_BACKSTYLE_COLOR,Option for background appearance,Цветовая заливка,Cor sólida,Füllfarbe,Color sólido,Couleur uniforme
Texture,JGPHUD_GENERAL_BACKSTYLE_TEXTURE,Option for background appearance,Текстура,Textura,Textur,Texturizado,Texture
HUD background color,JGPHUD_GENERAL_BACKCOL,General background color,Цвет фона,Cor de fundo,Hintergrundfarbe,Color de fondo,Couleur d’arrière-plan
HUD background opacity,JGPHUD_GENERAL_BACKALPHA,General background opacity,Прозрачность фона,Opacidade,Hintergrunddeckkraft,Opacidad de fondo,Opacité de l’arrière-plan
Texture name,JGPHUD_GENERAL_BACKSTYLE_TEXNAME,"If the background mode is set to ""Texture"", this option will let the player input the name of the texture",Название текстуры,Nome da textura,Texturname,Nombre de la textura,Nom de la texture
"Enter the name of the desired texture here. It has to be
a texture that actually exists in the current game/mod.",JGPHUD_GENERAL_BACKSTYLE_TEXNAME_NOTE,"Keep under 3 lines
Use physical linebreaks (alt-Enter)","Укажите название текстуры. Эта текстура должна
существовать в текущей игре/текущем моде.","Insira o nome da textura aqui. Necessita ser uma
 textura que existe no jogo ou mod.","Trage den Namen der gewünschten Textur ein.
Die Textur muss im derzeitigen Spiel/Mod existieren.","Escribe el nombre de la textura. La textura
debe existir en el juego o mod actual.","Entrer le nom de la texture désirée ici. Cela doit être une
texture qui existe actuellement dans le jeu/mod actuel."
Texture fit mode,JGPHUD_GENERAL_BACKSTYLE_TEXFIT,An option that lets you choose whether the background HUD texture will be tiled or stretched to fit,Режим отрисовки текстуры,Modo de preenchimento da textura,Texturanpassung,Modo de ajuste de la textura,Mode d'ajustement des textures
Tile,JGPHUD_GENERAL_BACKSTYLE_TEXFIT_TILE,"Option for ""Texture fit mode""",Замостить,Repetir,Kacheln,Repetir,Carreau
Stretch,JGPHUD_GENERAL_BACKSTYLE_TEXFIT_STRETCH,"Option for ""Texture fit mode""",Растянуть,Esticar,Strecken,Estirar,Étiré
Size of icons,JGPHUD_GENERAL_ICONSIZE,"This is used for several different options: inventory bar, weapon slots, powerup display",Размер значков,Tamanho dos ícones,Icongrösse,Tamaño de los iconos,Taille des icônes
Reset ALL FlexiHUD settings to default,JGPHUD_GENERAL_RESETALL,Label for a menu command that resets ALL console variables related to FlexiHUD to their default values,Сбросить ВСЕ настройки FlexiHUD,Restaurar TODAS as configurações aos padrões,ALLE FlexiHUD-Einstellungen auf Vorgaben zurücksetzen,Reiniciar todas las configuraciones por defecto,Réinitialiser TOUTES les configurations de FlexiHUD par défault
Scale of the element,JGPHUD_ELEMENT_SCALE,"General string used in multiple submenus that is attached
to a slider that controls the scale of this element.",,,,,
Position anchor point,JGPHUD_ELEMENT_POS,Lets the player choose the anchor point on the screen for the specified HUD element,Точка привязки элемента,Ponto da âncora,Ankerpunkt,Punto de anclaje,Point d’ancrage
Top left,JGPHUD_POS_TOPLEFT,Anchor point for the HUD element on the screen,Верхний левый угол,Canto superior esquerdo,Oben links,Superior izquierda,Haut à gauche
Top center,JGPHUD_POS_TOPCENTER,Anchor point for the HUD element on the screen,Середина верхней границы,Centro superior,Oben mitte,Superior centrado,Haut au centre
Top right,JGPHUD_POS_TOPRIGHT,Anchor point for the HUD element on the screen,Верхний правый угол,Canto superior direito,Oben rechts,Superior derecha,Haut à droite
Left center,JGPHUD_POS_LEFTCENTER,Anchor point for the HUD element on the screen,Середина левой границы,Esquerda do centro,Mitte links,Centro izquierda,Centre à gauche
Center,JGPHUD_POS_CENTER,Anchor point for the HUD element on the screen,Центр экрана,Centro,Mitte,Centrado,Centre
Right center,JGPHUD_POS_RIGHTCENTER,Anchor point for the HUD element on the screen,Середина правой границы,Centro direito,Mitte rechts,Centro derecha,Centre à droite
Bottom left,JGPHUD_POS_BOTTOMLEFT,Anchor point for the HUD element on the screen,Нижний левый угол,Canto inferior esquerdo,Unten links,Inferior izquierda,Bas à gauche
Bottom center,JGPHUD_POS_BOTTOMCENTER,Anchor point for the HUD element on the screen,Середина нижней границы,Centro inferior,Unten mitte,Inferior centrado,Bas au centre
Bottom right,JGPHUD_POS_BOTTOMRIGHT,Anchor point for the HUD element on the screen,Нижний правый угол,Canto inferior direito,Unten rechts,Inferior derecha,Bas à droite
Horizontal offset,JGPHUD_ELEMENT_OFSX,General option (every HUD element can be offset from their anchor point with this),Горизонтальный сдвиг элемента,Deslocamento horizontal,Horizontaler Versatz,Desplazamiento horizontal,Décalage Horizontal
Vertical offset,JGPHUD_ELEMENT_OFSY,General option (every HUD element can be offset from their anchor point with this),Вертикальный сдвиг элемента,Deslocamento vertical,Vertikaler Versatz,Desplazamiento vertical,Décalage Vertical
Numbers' color,JGPHUD_ELEMENT_NUMCOL,"Generic option name. Used in any element that has numbers (e.g. inventory bar, weapon slots). This option lets you adjust the color of those numbers.",Цвет цифр,,,,
Alignment,JGPHUD_ELEMENT_ALIGNMENT,"Generic option name. Used in any element that supports differnet alignment options, mainly horizontal and vertical (for example, weapon slots, powerups, inventory bar).",,,,,
Incoming damage display,JGPHUD_DMGMARKERS_TITLE,Title for the damage display settings,Индикаторы получаемого урона,Marcadores de dano,Ankommender Schaden,Marcador de daño,Affichage des dommages entrants
Classic screen reddening multiplier,JGPHUD_DMGMARKERS_SCREENTINT,"This lets the player change the multiplier for the classic red screen tint when they take damage. If they prefer to only rely on damage markers as a damage indicator, they may choose to reduce this to 0.",Степень покраснения экрана при получении урона,Multiplicador do tinto de dano na tela,Multiplikator für klassische Bildschirmrötung,Enrojecimiento clásico,Multiplicateur de rougissement de l'écran classique
Directional incoming damage markers,JGPHUD_DMGMARKERS_ENABLE,"Directional damage markers are shown on the HUD, pointing to the enemy that just attacked the player",Направленные индикаторы получаемого урона,Marcadores de dano direcionais,Richtungsmarker für ankommenden Schaden,Marcador de daño direccional,Marqueurs directionnels de dégâts entrants
Maximum damage marker opacity,JGPHUD_DMGMARKERS_MAXALPHA,,Прозрачность индикаторов получаемого урона,Opacidade máxima do marcador de dano,Markerdeckkraft für Maximalschaden,Opacidad máxima de marcadores,Opacité maximale du marqueur de dégâts
Damage marker fade-out time (seconds),JGPHUD_DMGMARKERS_FADEOUTTIME,,Время исчезновения индикаторов урона (сек.),Tempo de desvanecimento do marcador de dano (segundos),Ausblendzeit für Schadensmarker (Sekunden),Desvanecimiento de marcadores (segundos),Temps d'évanouissement du marqueur de dommage (secondes)
"Health, armor and mugshot",JGPHUD_MAINBARS_TITLE,,"Здоровье, броня и лицо персонажа","Vida, armadura e rosto do personagem","Gesundheit, Rüstung und Gesicht",Vida y armadura,"Santé, armure et visage"
Health and armor display,JGPHUD_MAINBARS_ENABLE,Whether health/armor is displayed,Отображение здоровья и брони,Exibir barras de vida e armadura,Gesundheit und Rüstung anzeigen,Mostrar vida y armadura,Affichage de santé et d’armure
Mugshot display (if exists),JGPHUD_MAINBARS_SHOWFACE,Whether mugshot is displayed,Показывать лицо персонажа (при наличии),Mostrar rosto do personagem (se existe),Gesicht anzeigen (falls vorhanden),Mostrar cara de jugador (si existe),Affichage du visage (si existant)
Numbers,JGPHUD_MAINBARS_OPT_NUMBERS,Option for how health/armor is displayed: numbers or bars,Цифры,Números,Nummern,Numérico,Nombres
Bars,JGPHUD_MAINBARS_OPT_BARS,Option for how health/armor is displayed: numbers or bars,Шкалы,Barras,Leisten,Barra,Barres
Armor icon/absorption display,JPGHUD_MAINBARS_ARMDISPLAY,"Option that controls what is displayed next to the armor numbers: the armor's icon, its absorption percentage, or both (icon below, percentage on top)",,,,,
Armor icon,JPGHUD_MAINBARS_ARMDISPLAY_ICON,Option for Armor icon/absorption display,,,,,
Armor absorption %,JPGHUD_MAINBARS_ARMDISPLAY_ABSORB,Option for Armor icon/absorption display,,,,,
Armor icon and absorption %,JPGHUD_MAINBARS_ARMDISPLAY_BOTH,Option for Armor icon/absorption display,,,,,
Health and armor color settings,JGPHUD_MAINBARS_NUMCOL_TITLE,"Title for a submenu with health/armor color settings. Located under ""Health and armor display"" menu",,,,,
Armor colors,JGPHUD_MAINBARS_NUMCOL_ARMOR_TITLE,Subtitle for Health and armor color settings menu,,,,,
Health colors,JGPHUD_MAINBARS_NUMCOL_HEALTH_TITLE,Subtitle for Health and armor color settings menu,,,,,
Colorization rules,JGPHUD_MAINBARS_NUMCOL,This option allows adjusting the rules by which the Armor colors and Health colors are colorized. The options for Armor and Health are separate but their names are identical (they're just positioned in different sections).,,,,,
Color reflects armor absorption,JGPHUD_MAINBARS_NUMCOL_ABSORB,Option for Number colorization rules (this one is only for Armor: color reflects the damage absorption of the current armor),,,,,
Color reflects remaining amount,JGPHUD_MAINBARS_NUMCOL_AMOUNT,Option for Number colorization rules: color changes based on the remaining amount of Armor/Health,,,,,
Always single color,JGPHUD_MAINBARS_NUMCOL_FIXED,Option for Number colorization rules: one fixed color,,,,,
Single color,JGPHUD_MAINBARS_NUMCOL_FIXED_LABEL,,,,,,
Choose colors:,JGPHUD_MAINBARS_NUMCOL_CHOOSE,,,,,,
0-25% amount color,JGPHUD_MAINBARS_NUMCOL_AMTRANGE_25,The color used when the AMOUNT is in this range,,,,,
26-50% amount color,JGPHUD_MAINBARS_NUMCOL_AMTRANGE_50,The color used when the AMOUNT is in this range,,,,,
51-75% amount color,JGPHUD_MAINBARS_NUMCOL_AMTRANGE_75,The color used when the AMOUNT is in this range,,,,,
76-100% amount color,JGPHUD_MAINBARS_NUMCOL_AMTRANGE_100,The color used when the AMOUNT is in this range,,,,,
101+% amount color,JGPHUD_MAINBARS_NUMCOL_AMTRANGE_101,The color used when the AMOUNT is in this range,,,,,
33% absorption color,JGPHUD_MAINBARS_NUMCOL_ABSRANGE_33,The color used when the ABSORPTION is in this range,,,,,
50% absorption color,JGPHUD_MAINBARS_NUMCOL_ABSRANGE_50,The color used when the ABSORPTION is in this range,,,,,
66% absorption color,JGPHUD_MAINBARS_NUMCOL_ABSRANGE_66,The color used when the ABSORPTION is in this range,,,,,
80% absorption color,JGPHUD_MAINBARS_NUMCOL_ABSRANGE_80,The color used when the ABSORPTION is in this range,,,,,
100% absorption color,JGPHUD_MAINBARS_NUMCOL_ABSRANGE_100,The color used when the ABSORPTION is in this range,,,,,
Current ammo and weapon,JGPHUD_AMMOBLOCK_TITLE,,Текущий боезапас и оружие,Munição e arma atual,Aktuelle Munition und Waffe,Arma y munición actual,Armes et munitions actuelles
Current ammo display,JGPHUD_AMMOBLOCK_ENABLE,Whether current ammo is displayed,Показывать патроны для текущего оружия,Mostrar munição atual,Aktuelle Munition anzeigen,Mostrar munición actual,Affichage des munitions actuelles
Display weapon icon,JGPHUD_AMMOBLOCK_SHOWWEAP,Whether selected weapon icon is displayed,Показывать значок текущего оружия,Mostrar ícone de arma,Aktuelle Waffe anzeigen,Mostrar icono del arma,Affichage des icônes d’armes
Display ammo bar,JGPHUD_AMMOBLOCK_SHOWAMMOBAR,"Whether a gauge for the ammo is displayed. If this is false, only the number will be shown.",Показывать шкалу остатка патронов,Mostrar barra de munição,Munitionsleiste anzeigen,Mostrar barra de munición,Affichage de la barre de munitions
All ammo,JGPHUD_ALLAMMO_TITLE,,Общий боезапас,Munição no inventário,Gesamte Munition,Todas las municiones,Toutes les munitions
Display all ammo,JGPHUD_ALLAMMO_ENABLE,Whether to display a separate block with all ammo currently in the player's inventory.  Has several options,Показывать общий боезапас,Mostrar munição no inventário,Gesamte Munition anzeigen,Mostrar todas las municiones,Affichage de toutes les munitions
For the weapons you have,JGPHUD_ALLAMMO_OWNEDWEAPONS,All Ammo block option: only draw ammo icons/amounts for the weapons the player has in their inventory,Только для оружия в инвентаре,Para as armas que você tem,Nur für mitgeführte Waffen,Para armas en posesión,Pour les armes que vous avez
For all weapons in the game,JGPHUD_ALLAMMO_ALLWEAPONS,All Ammo block options: draw ammo for all weapons that exist in the current game,Для всех видов оружия в игре,Para todas as armas no jogo,Für alle Waffen im Spiel,Para todas las armas,Pour toutes les armes du jeu
Show depleted ammo,JGPHUD_ALLAMMO_SHOWDEPLETED,Whether to show the ammo you've run out of in the All Ammo block (On/Off),Показывать израсходованные патроны,Mostrar tipos de munição esgotados,Verbrauchte Munition anzeigen,Mostrar municiones vacias,Afficher les munitions épuisées
Number of columns,JGPHUD_ALLAMMO_COLUMNS,,,,,,
Display format,JGPHUD_ALLAMMO_DISPLAYFORMAT,,,,,,
Current amount only,JGPHUD_ALLAMMO_DISPLAYFORMAT_NOMAX,,,,,,
Current amount / Max amount,JGPHUD_ALLAMMO_DISPLAYFORMAT_MAX,,,,,,
Keys,JGPHUD_KEYS_TITLE,,Ключи,Chaves,Schlüssel,Llaves,Clés
Keys display,JGPHUD_KEYS_ENABLE,Whether to show keys on the HUD,Показывать ключи,Mostrar chaves,Schlüssel anzeigen,Mostrar llaves,Affichage des clés
Weapon slots,JGPHUD_WEAPSLOTS_TITLE,,Ячейки оружия,Ícones de arma,Waffenplätze,Slots de armas,Emplacements d'armes
Weapon slots display,JGPHUD_WEAPSLOTS_ENABLE,Whether to show weapon slots on the HUD,Показывать ячейки оружия,Mostrar ícones de arma,Waffenplätze anzeigen,Mostrar slots de armas,Affichage des emplacements d'armes
Horizontal,JGPHUD_WEAPSLOTS_ALIGNMENT_H,Weapon slots alignment option,По горизонтали,Horizontal,Horizontal,Horizontal,Horizontal
Vertical,JGPHUD_WEAPSLOTS_ALIGNMENT_V,"Weapon slots alignment option (vertical, first slot at the top)",По вертикали (сверху вниз),Vertical,Vertikal,Vertical,Vertical
Vertical inverted,JGPHUD_WEAPSLOTS_ALIGNMENT_VINV,"Weapon slots alignment option (vertical, first slot at the bottom)",По вертикали (снизу вверх),Vertical invertido,Vertikal invertiert,Vertical invertido,Vertical Inversé
Powerup timers,JGPHUD_POWERUPS_TITLE,Title for the submenu,Таймеры усилений,Temporizadores de powerup,Powerup-Timer,Contadores de powerups,Temps des powerups
Powerup timers display,JGPHUD_POWERUPS_ENABLE,Whether  to show visible timers (minutes and seconds) for currently active power-ups,Показывать таймеры усилений,Mostrar temporizadores de powerup,Powerup-Timer anzeigen,Mostrar contadores de powerups,Affichage du temps des powerups
Inventory bar,JGPHUD_INVBAR_TITLE,Title for the submenu,Полоса инвентаря,Barra de inventário,Inventarleiste,Barra de inventario,Barre d’inventaire
Inventory bar display,JGPHUD_INVBAR_ENABLE,"Whether to show an inventory bar (where applicable, like Heretic, Hexen, Strife)",Показывать полосу инвентаря,Mostrar barra de inventário,Inventarleiste anzeigen,Mostrar barra de inventario,Affichage de la barre d’inventaire
Always show full inventory bar,JGPHUD_INVBAR_ENABLEALWAYS,"If this is false, inventory bar will auto-hide after 2 seconds and only the currently selected item will be shown.",Не скрывать полосу инвентаря,Sempre mostrar barra de inventário,Immer ganze Inventarleiste anzeigen,Siempre mostrar todo el inventario,Toujours afficher la barre d'inventaire complète
"If inventory bar is always shown, ""Use Item"" button will
instantly use the item. If not, first press will select the
item, second press will use it.",JGPHUD_INVBAR_ENABLEALWAYS_NOTE,"Keep under 4 lines! Use real linebreaks (Ctrl-Enter) to add new lines, so that each line is under 60 characters","Если полоса инвентаря всегда включена, кнопка «Использовать
предмет» сразу использует его. В противном случае первое
нажатие выбирает предмет, а второе использует.","Se a barra de inventário estiver sempre mostrando, o botão
 ""Usar item"" funciona instantâneamente, caso contrário,
 pressionar uma vez selecionará o item, e a segunda vez irá usa-lo.","""Gegenstand aktivieren"" aktiviert Gegenstände sofort,
falls die ganze Inventarleiste angezeigt wird.
Falls nicht, werden Gegenstände beim ersten Drücken
ausgewählt und beim zweiten Drücken aktiviert.","Si la barra de inventario siempre se muestra, ""Usar objeto""
usará el objeto de inmediato, de lo contrario, primero se
seleccionará y luego se usará.","Si la barre d'inventaire est toujours affichée, le bouton
""Utiliser l'objet"" utilise instantanément l'objet. Sinon, la première
pression sélectionnera l'objet, la seconde l'utilisera."
"Note: Inventory bar will only appear in games/mods
that have items that can be placed in inventory
and used from it.",JGPHUD_INVBAR_NOTE,"Keep under 4 lines! Use real linebreaks (Ctrl-Enter) to add new lines, so that each line is under 60 characters","Внимание: полоса инвентаря отображается, только если
в игре/моде есть предметы, которые можно использовать
из инвентаря.","Obs.: Barra de inventário aparece apenas em jogos/mods
 que têm itens que podem ser colocados no inventário.","Beachte: Inventarleiste wird nur in Spielen/Mods
angezeigt, in denen Gegenstände vom Inventar aus
aktiviert werden können.","Nota: la barra solo aparecerá en juegos y mods que
contengan objetos de inventario utilizables.","Remarque : la barre d'inventaire n'apparaît que dans les
jeux/mods dont les objets peuvent être placés dans
l'inventaire et être utilisés à partir de celui-ci."
"Minimap, radar and map data",JGPHUD_MAPDATA_GEN_TITLE,General title for the submenu that contains minimap and map data settings,Мини-карта и данные об уровне,"Minimapa, radar e informações do mapa","Minikarte, Radar und Kartendaten","Minimapa, radar e información","Minimap, radar et données de la carte"
Minimap and monster radar,JGPHUD_MINIMAP_TITLE,Option block title,Мини-карта,Minimapa e radar de monstros,Minikarte und Monsterradar,Minimapa y radar de monstruos,Minimap et radar à monstres
"Note: The minimap may cause performance issues on maps
with complex geometry, especially at low zoom values.",JGPHUD_MINIMAP_NOTE,"Keep under 4 lines! Use real linebreaks (Ctrl-Enter) to add new lines, so that each line is under 60 characters","Примечание: мини-карта может вызывать проблемы с
производительностью на уровнях со сложной геометрией,
особенно при низком приближении.","Obs.: O minimapa pode causar problemas de
desempenho em mapas complexos.","Beachte: Minikarte kann Leistungseinbrüche auf Karten mit
komplexer Geometrie verursachen, insbesondere bei
niedrigem Zoom.","Nota: el minimapa puede causar pérdida de cuadros en
mapas complejos, especialmente con bajo zoom.","Remarque : la minimap peut entraîner des problèmes de
performance sur les cartes à géométrie complexe, en
particulier lorsque le zoom est faible. à géométrie
complexe, en particulier lorsque le zoom est faible."
Minimap and monster radar display,JGPHUD_MINIMAP_ENABLE,Whether to draw the minimap and the enemy markers. Possible values: Off / Minimap only / Enemy markers only / Both,Отображение мини-карты и маркеров врагов,Mostrar minimapa,Anzeige für Minikarte und Monsterradar,Minimapa y radar de monstruos,Minimap et affichage du radar à monstres
Minimap only,JGPHUD_MINIMAP_MAPONLY,"Possible value for ""Minimap and enemy radar display"" option",Только мини-карта,Somente minimapa,Nur Minikarte,Solo minimapa,Mini-carte seulement
Monster markers only,JGPHUD_MINIMAP_RADARONLY,"Possible value for ""Minimap and enemy radar display"" option",Только маркеры врагов,Somente marcadores de monstro,Nur Monstermarker,Solo marcadores de monstruos,Marqueurs de monstres uniquement
Minimap and monster markers,JGPHUD_MINIMAP_BOTH,"Possible value for ""Minimap and enemy radar display"" option",Мини-карта и маркеры врагов,Minimapa e marcadores de monstro,Minikarte und Monstermarker,Minimapa y marcadores,Minimap et marqueurs de monstres
Background opacity,JGPHUD_MINIMAP_OPACITY,A 0.0-1.0 slider that determines the opacity of the minimap/radar background,Прозрачность фона,Opacidade do fundo,Hintergrunddeckkraft,Opacidad de fondo,Opacité de l'arrière-plan
Minimap/radar size,JGPHUD_MINIMAP_SIZE,A slider,Размер мини-карты/радара,Tamanho do minimapa e radar,Minikarten- und Radargrösse,Tamaño del mapa y radar,Taille de la mini-carte/radar
Minimap/radar shape,JGPHUD_MINIMAP_SHAPE,Square or circle,Форма мини-карты/радара,Formato do minimapa e radar,Minikarten- und Radarform,Forma del mapa y radar,Forme de la mini-carte/radar
Minimap/radar zoom,JGPHUD_MINIMAP_ZOOM,A slider for the zoom value,Приближение мини-карты/радара,Zoom do minimapa e radar,Minikarten- und Radarzoom,Zoom del mapa y radar,Zoom de la mini-carte/radar
Minimap/radar color set,JGPHUD_MINIMAP_COLORSET,"General option for the minimap that determines which colors will be used. At 0 uses same colors as the automap, at 1 uses custom colors.",Цвета мини-карты/радара,,,,
Same as automap,JGPHUD_MINIMAP_DEFAULTCOLORS,"Option for ""Minimap/radar color set"". If this is set, the minimap will use the same colors as GZDoom's automap.","Те же, что в автокарте",,,,
Circle,JGPHUD_MINIMAP_SHAPE_CIRCLE,possible minimap shape,Круг,Círculo,Kreis,Circular,Cercle
Square,JGPHUD_MINIMAP_SHAPE_SQUARE,possible minimap shape,Квадрат,Quadrado,Quadrat,Cuadrada,Carré
Monster markers display,JGPHUD_MINIMAP_ENEMIES,"Whether to show enemies on the minimap. Possible options: Only alerted enemies / All enemies
This option becomes available when ""Minimap and enemy radar display"" is set either to ""Enemy markers only"" or ""Minimap and enemy markers""",Отображение маркеров врагов,Mostrar marcadores de monstro,Monstermarker-Anzeige,Marcadores de monstruos,Affichage des marqueurs de monstres
Only alerted monsters,JGPHUD_MINIMAP_ENEMIES_ALERTED,"Option for ""Show enemies on the minimap""",Только для активных врагов,Somente monstros alertas,Nur alarmierte Monster,Solo en alerta,Uniquement les monstres alertés
All monsters,JGPHUD_MINIMAP_ENEMIES_ALL,"Option for ""Show enemies on the minimap""",Для всех врагов,Todos os monstros,Alle Monster,Todos,
