default,identifier,remarks,ru,pt,de,esm,fr
FlexiHUD settings,JGPHUD_SETTINGS_TITLE,"FlexiHUD is the mod's name, do not localize",Настройки FlexiHUD,Configurações do FlexiHUD,FlexiHUD Einstellungen,Configuración de FlexiHUD,Configuration de FlexiHud
Display FlexiHUD,JGPHUD_GENERAL_ENABLEHUD,A simple On/Off toggle that allows to completely disable the whole HUD,Показывать FlexiHUD,,,,
Toggle FlexiHUD key,JGPHUD_GENERAL_ENABLEHUD_BIND,An option that lets you specify a custom key that will toggle the HUD on and off,Клавиша вкл/откл FlexiHUD,,,,
General,JGPHUD_GENERAL_TITLE,Title for the general options,Общее,Geral,Allgemein,General,General
HUD background style,JGPHUD_GENERAL_BACKSTYLE,General appearance of the background: either a flat color or a texture,Стиль фона,Estilo do fundo,Hintergrundstil,Estilo de fondo,Style d'arrière-plan de l’ATH
Flat color,JGPHUD_GENERAL_BACKSTYLE_COLOR,Option for background appearance,Цветовая заливка,Cor sólida,Füllfarbe,Color sólido,Couleur uniforme
Texture,JGPHUD_GENERAL_BACKSTYLE_TEXTURE,Option for background appearance,Текстура,Textura,Textur,Texturizado,Texture
HUD background color,JGPHUD_GENERAL_BACKCOL,General background color,Цвет фона,Cor de fundo,Hintergrundfarbe,Color de fondo,Couleur d’arrière-plan
HUD background opacity,JGPHUD_GENERAL_BACKALPHA,General background opacity,Прозрачность фона,Opacidade,Hintergrunddeckkraft,Opacidad de fondo,Opacité de l’arrière-plan
Texture name,JGPHUD_GENERAL_BACKSTYLE_TEXNAME,"If the background mode is set to ""Texture"", this option will let the player input the name of the texture",Название текстуры,Nome da textura,Texturname,Nombre de la textura,Nom de texture
"Enter the name of the desired texture here. It has to be
a texture that actually exists in the current game/mod.",JGPHUD_GENERAL_BACKSTYLE_TEXNAME_NOTE,"Keep under 3 lines
Use physical linebreaks (alt-Enter)","Укажите название текстуры. Эта текстура должна
существовать в текущей игре/текущем моде.","Insira o nome da textura aqui. Necessita ser uma
textura que existe no jogo ou mod.","Trage den Namen der gewünschten Textur ein.
Die Textur muss im derzeitigen Spiel/Mod existieren.","Escribe el nombre de la textura. La textura
debe existir en el juego o mod actual.","Entrer le nom de la texture désirée ici. Cela doit être une
texture qui existe actuellement dans le jeu/mod actuel."
Texture fit mode,JGPHUD_GENERAL_BACKSTYLE_TEXFIT,An option that lets you choose whether the background HUD texture will be tiled or stretched to fit,Режим отрисовки текстуры,,,,
Tile,JGPHUD_GENERAL_BACKSTYLE_TEXFIT_TILE,"Option for ""Texture fit mode""",Замостить,,,,
Stretch,JGPHUD_GENERAL_BACKSTYLE_TEXFIT_STRETCH,"Option for ""Texture fit mode""",Растянуть,,,,
Size of icons,JGPHUD_GENERAL_ICONSIZE,"This is used for several different options: inventory bar, weapon slots, powerup display",Размер значков,Tamanho dos ícones,Icongrösse,Tamaño de los iconos,Taille des icones
Reset ALL FlexiHUD settings to default,JGPHUD_GENERAL_RESETALL,Label for a menu command that resets ALL console variables related to FlexiHUD to their default values,Сбросить ВСЕ настройки FlexiHUD,Restaurar TODAS as configurações aos padrões,ALLE FlexiHUD-Einstellungen auf Vorgaben zurücksetzen,Reiniciar todas las configuraciones por defecto,Réinitialiser TOUTES les configurations de FlexiHUD par défault
Position anchor point,JGPHUD_ELEMENT_POS,Lets the player choose the anchor point on the screen for the specified HUD element,Точка привязки элемента,Ponto da âncora,Ankerpunkt,Punto de anclaje,Point d’ancrage
Top left,JGPHUD_POS_TOPLEFT,Anchor point for the HUD element on the screen,Верхний левый угол,Canto superior esquerdo,Oben links,Superior izquierda,Haut à gauche
Top center,JGPHUD_POS_TOPCENTER,Anchor point for the HUD element on the screen,Середина верхней границы,Centro superior,Oben mitte,Superior centrado,Haut au centre
Top right,JGPHUD_POS_TOPRIGHT,Anchor point for the HUD element on the screen,Верхний правый угол,Canto superior direito,Oben rechts,Superior derecha,Haut à droite
Left center,JGPHUD_POS_LEFTCENTER,Anchor point for the HUD element on the screen,Середина левой границы,Esquerda do centro,Mitte links,Centro izquierda,Centre à gauche
Center,JGPHUD_POS_CENTER,Anchor point for the HUD element on the screen,Центр экрана,Centro,Mitte,Centrado,Centre
Right center,JGPHUD_POS_RIGHTCENTER,Anchor point for the HUD element on the screen,Середина правой границы,Centro direito,Mitte rechts,Centro derecha,Centre à droite
Bottom left,JGPHUD_POS_BOTTOMLEFT,Anchor point for the HUD element on the screen,Нижний левый угол,Canto inferior esquerdo,Unten links,Inferior izquierda,Bas à gauche
Bottom center,JGPHUD_POS_BOTTOMCENTER,Anchor point for the HUD element on the screen,Середина нижней границы,Centro inferior,Unten mitte,Inferior centrado,Bas au centre
Bottom right,JGPHUD_POS_BOTTOMRIGHT,Anchor point for the HUD element on the screen,Нижний правый угол,Canto inferior direito,Unten rechts,Inferior derecha,Bas à droite
Horizontal offset,JGPHUD_ELEMENT_OFSX,General option (every HUD element can be offset from their anchor point with this),Горизонтальный сдвиг элемента,Deslocamento horizontal,Horizontaler Versatz,Desplazamiento horizontal,Décalage Horizontal
Vertical offset,JGPHUD_ELEMENT_OFSY,General option (every HUD element can be offset from their anchor point with this),Вертикальный сдвиг элемента,Deslocamento vertical,Vertikaler Versatz,Desplazamiento vertical,Décalage Vertical
Incoming damage display,JGPHUD_DMGMARKERS_TITLE,Title for the damage display settings,Индикаторы получаемого урона,Marcadores de dano,Ankommender Schaden,Marcador de daño,Affichage des dommages entrants
Classic screen reddening multiplier,JGPHUD_DMGMARKERS_SCREENTINT,"This lets the player change the multiplier for the classic red screen tint when they take damage. If they prefer to only rely on damage markers as a damage indicator, they may choose to reduce this to 0.",Степень покраснения экрана при получении урона,Envermelhação clássica da tela,Multiplikator für klassische Bildschirmrötung,Enrojecimiento clásico,Multiplicateur de rougissement de l'écran classique
Directional incoming damage markers,JGPHUD_DMGMARKERS_ENABLE,"Directional damage markers are shown on the HUD, pointing to the enemy that just attacked the player",Направленные индикаторы получаемого урона,Marcadores de dano direcionais,Richtungsmarker für ankommenden Schaden,Marcador de daño direccional,Marqueurs directionnels de dégâts entrants
Maximum damage marker opacity,JGPHUD_DMGMARKERS_MAXALPHA,,Прозрачность индикаторов получаемого урона,Opacidade máxima do marcador de dano,Markerdeckkraft für Maximalschaden,Opacidad máxima de marcadores,Opacité maximale du marqueur de dégâts
Damage marker fade-out time (seconds),JGPHUD_DMGMARKERS_FADEOUTTIME,,Время исчезновения индикаторов урона (сек.),Tempo de desvanecimento do marcador de dano (segundos),Ausblendzeit für Schadensmarker (Sekunden),Desvanecimiento de marcadores (segundos),Temps d'évanouissement du marqueur de dommage (secondes)
"Health, armor and mugshot",JGPHUD_MAINBARS_TITLE,,"Здоровье, броня и лицо персонажа","Vida, armadura e face do personagem","Gesundheit, Rüstung und Gesicht",Vida y armadura,"Santé, armure et visage"
Health and armor display,JGPHUD_MAINBARS_ENABLE,Whether health/armor is displayed,Отображение здоровья и брони,Exibir barras de vida e armadura,Gesundheit und Rüstung anzeigen,Mostrar vida y armadura,Affichage de santé et d’armure
Mugshot display (if exists),JGPHUD_MAINBARS_SHOWFACE,Whether mugshot is displayed,Показывать лицо персонажа (при наличии),Mostrar face do personagem (se existe),Gesicht anzeigen (falls vorhanden),Mostrar cara de jugador (si existe),Affichage du visage (si existant)
Numbers,JGPHUD_MAINBARS_OPT_NUMBERS,Option for how health/armor is displayed: numbers or bars,Цифры,Números,Nummern,Numérico,Nombres
Bars,JGPHUD_MAINBARS_OPT_BARS,Option for how health/armor is displayed: numbers or bars,Шкалы,Barras,Leisten,Barra,Barres
Current ammo and weapon,JGPHUD_AMMOBLOCK_TITLE,,Текущий боезапас и оружие,Munição e arma atual,Aktuelle Munition und Waffe,Arma y munición actual,Armes et munitions actuelles
Current ammo display,JGPHUD_AMMOBLOCK_ENABLE,Whether current ammo is displayed,Показывать патроны для текущего оружия,Mostrar munição atual,Aktuelle Munition anzeigen,Mostrar munición actual,Affichage des munitions actuelles
Display weapon icon,JGPHUD_AMMOBLOCK_SHOWWEAP,Whether selected weapon icon is displayed,Показывать значок текущего оружия,Mostrar ícone de arma,Aktuelle Waffe anzeigen,Mostrar icono del arma,Affichage des icônes d’armes
Display ammo bar,JGPHUD_AMMOBLOCK_SHOWAMMOBAR,"Whether a gauge for the ammo is displayed. If this is false, only the number will be shown.",Показывать шкалу остатка патронов,Mostrar barra de munição,Munitionsleiste anzeigen,Mostrar barra de munición,Affichage de la barre de munitions
All ammo,JGPHUD_ALLAMMO_TITLE,,Общий боезапас,Munição no inventário,Gesamte Munition,Todas las municiones,Toutes les munitions
Display all ammo,JGPHUD_ALLAMMO_ENABLE,Whether to display a separate block with all ammo currently in the player's inventory.  Has several options,Показывать общий боезапас,Mostrar munição no inventário,Gesamte Munition anzeigen,Mostrar todas las municiones,Affichage de toutes les munitions
For the weapons you have,JGPHUD_ALLAMMO_OWNEDWEAPONS,All Ammo block option: only draw ammo icons/amounts for the weapons the player has in their inventory,Только для оружия в инвентаре,Pour les armes que vous avez,Nur für mitgeführte Waffen,Para armas en posesión,Pour les armes que vous avez
For all weapons in the game,JGPHUD_ALLAMMO_ALLWEAPONS,All Ammo block options: draw ammo for all weapons that exist in the current game,Для всех видов оружия в игре,Pour toutes les armes du je,Für alle Waffen im Spiel,Para todas las armas,Pour toutes les armes du jeu
Show depleted ammo,JGPHUD_ALLAMMO_SHOWDEPLETED,Whether to show the ammo you've run out of in the All Ammo block (On/Off),Показывать израсходованные патроны,Afficher les munitions épuisées,Verbrauchte Munition anzeigen,Mostrar municiones vacias,Afficher les munitions épuisées
Keys,JGPHUD_KEYS_TITLE,,Ключи,Chaves,Schlüssel,Llaves,Clés
Keys display,JGPHUD_KEYS_ENABLE,Whether to show keys on the HUD,Показывать ключи,Mostrar chaves,Schlüssel anzeigen,Mostrar llaves,Affichage des clés
Weapon slots,JGPHUD_WEAPSLOTS_TITLE,,Ячейки оружия,Ícones de arma,Waffenplätze,Slots de armas,Emplacements d'armes
Weapon slots display,JGPHUD_WEAPSLOTS_ENABLE,Whether to show weapon slots on the HUD,Показывать ячейки оружия,Mostrar ícones de arma,Waffenplätze anzeigen,Mostrar slots de armas,Affichage des emplacements d'armes
Weapon slots alignment,JGPHUD_WEAPSLOTS_ALIGNMENT,How the slots are aligned (vertically or horizontally),Порядок ячеек оружия,Alinhamento dos ícones de arma,Waffenplatzanordnung,Alineamiento de slots,Alignement des emplacements d’armes
Horizontal,JGPHUD_WEAPSLOTS_ALIGNMENT_H,Weapon slots alignment option,По горизонтали,Horizontal,Horizontal,Horizontal,Horizontal
Vertical,JGPHUD_WEAPSLOTS_ALIGNMENT_V,"Weapon slots alignment option (vertical, first slot at the top)",По вертикали (сверху вниз),Vertical,Vertikal,Vertical,Vertical
Vertical inverted,JGPHUD_WEAPSLOTS_ALIGNMENT_VINV,"Weapon slots alignment option (vertical, first slot at the bottom)",По вертикали (снизу вверх),Vertical invertido,Vertikal invertiert,Vertical invertido,Vertical Inversé
Powerup timers,JGPHUD_POWERUPS_TITLE,Title for the submenu,Таймеры усилений,Temporizadores de powerup,Powerup-Timer,Contadores de powerups,Temps des powerups
Powerup timers display,JGPHUD_POWERUPS_ENABLE,Whether  to show visible timers (minutes and seconds) for currently active power-ups,Показывать таймеры усилений,Mostrar temporizadores de powerup,Powerup-Timer anzeigen,Mostrar contadores de powerups,Affichage du temps des powerups
Inventory bar,JGPHUD_INVBAR_TITLE,Title for the submenu,Полоска инвентаря,Barra de inventário,Inventarleiste,Barra de inventario,Barre d’inventaire
Inventory bar display,JGPHUD_INVBAR_ENABLE,"Whether to show an inventory bar (where applicable, like Heretic, Hexen, Strife)",Показывать полосу инвентаря,Mostrar barra de inventário,Inventarleiste anzeigen,Mostrar barra de inventario,Affichage de la barre d’inventaire
Always show full inventory bar,JGPHUD_INVBAR_ENABLEALWAYS,"If this is false, inventory bar will auto-hide after 2 seconds and only the currently selected item will be shown.",Не скрывать полосу инвентаря,Sempre mostrar barra de inventário,Immer ganze Inventarleiste anzeigen,Siempre mostrar todo el inventario,Toujours afficher la barre d'inventaire complète
"If inventory bar is always shown, ""Use Item"" button will
instantly use the item. If not, first press will select the
item, second press will use it.",JGPHUD_INVBAR_ENABLEALWAYS_NOTE,"Keep under 4 lines! Use real linebreaks (Ctrl-Enter) to add new lines, so that each line is under 60 characters","Если полоса инвентаря всегда включена, кнопка «Использовать
предмет» сразу использует его. В противном случае первое
нажатие выбирает предмет, а второе использует.","Se a barra de inventário estiver sempre mostrando, o botão
""Usar item"" funciona instantâneamente, caso contrário,
pressionar uma vez selecionará o item, e a segunda vez irá usa-lo.","""Gegenstand aktivieren"" aktiviert Gegenstände sofort,
falls die ganze Inventarleiste angezeigt wird.
Falls nicht, werden Gegenstände beim ersten Drücken
ausgewählt und beim zweiten Drücken aktiviert.","Si la barra de inventario siempre se muestra, ""Usar objeto""
usará el objeto de inmediato, de lo contrario, primero se
seleccionará y luego se usará.","Si la barre d'inventaire est toujours affichée, le bouton
""Utiliser l'objet"" utilise instantanément l'objet. Sinon, la première
pression sélectionnera l'objet, la seconde l'utilisera."
"Note: Inventory bar will only appear in games/mods
that have items that can be placed in inventory
and used from it.",JGPHUD_INVBAR_NOTE,"Keep under 4 lines! Use real linebreaks (Ctrl-Enter) to add new lines, so that each line is under 60 characters","Внимание: полоса инвентаря отображается, только если
в игре/моде есть предметы, которые можно использовать
из инвентаря.","Obs.: Barra de inventário aparece apenas em jogos/mods
que têm itens que podem ser colocados no inventário.","Beachte: Inventarleiste wird nur in Spielen/Mods
angezeigt, in denen Gegenstände vom Inventar aus
aktiviert werden können.","Nota: la barra solo aparecerá en juegos y mods que
contengan objetos de inventario utilizables.","Remarque : la barre d'inventaire n'apparaît que dans les
jeux/mods dont les objets peuvent être placés dans
l'inventaire et être utilisés à partir de celui-ci."
"Minimap, radar and map data",JGPHUD_MAPDATA_GEN_TITLE,General title for the submenu that contains minimap and map data settings,Мини-карта и данные об уровне,,,,
Minimap and monster radar,JGPHUD_MINIMAP_TITLE,Option block title,Мини-карта,,,,
"Note: The minimap may cause performance issues on maps
with complex geometry, especially at low zoom values.",JGPHUD_MINIMAP_NOTE,"Keep under 4 lines! Use real linebreaks (Ctrl-Enter) to add new lines, so that each line is under 60 characters","Примечание: мини-карта может вызывать проблемы с
производительностью на уровнях со сложной геометрией,
особенно при низком приближении.","Obs.: O minimapa pode causar problemas de
desempenho em mapas complexos.","Beachte: Minikarte kann Leistungseinbrüche auf Karten mit
komplexer Geometrie verursachen, insbesondere bei
niedrigem Zoom.","Nota: el minimapa puede causar pérdida de cuadros en
mapas complejos, especialmente con bajo zoom.","Remarque : la minimap peut entraîner des problèmes de
performance sur les cartes à géométrie complexe, en
particulier lorsque le zoom est faible. à géométrie
complexe, en particulier lorsque le zoom est faible."
Minimap and monster radar display,JGPHUD_MINIMAP_ENABLE,Whether to draw the minimap and the enemy markers. Possible values: Off / Minimap only / Enemy markers only / Both,Отображение мини-карты и маркеров врагов,,,,
Minimap only,JGPHUD_MINIMAP_MAPONLY,"Possible value for ""Minimap and enemy radar display"" option",Только мини-карта,Apenas minimapa,Nur Minikarte,Solo minimapa,Mini-carte seulement
Monster markers only,JGPHUD_MINIMAP_RADARONLY,"Possible value for ""Minimap and enemy radar display"" option",Только маркеры врагов,,,,
Minimap and monster markers,JGPHUD_MINIMAP_BOTH,"Possible value for ""Minimap and enemy radar display"" option",Мини-карта и маркеры врагов,,,,
Minimap/radar size,JGPHUD_MINIMAP_SIZE,,Размер мини-карты/радара,,,,
Minimap/radar shape,JGPHUD_MINIMAP_SHAPE,,Форма мини-карты/радара,,,,
Minimap/radar zoom,JGPHUD_MINIMAP_ZOOM,minimap zoom value,Приближение мини-карты/радара,,,,
Circle,JGPHUD_MINIMAP_SHAPE_CIRCLE,possible minimap shape,Круг,Círculo,Kreis,Circular,Cercle
Square,JGPHUD_MINIMAP_SHAPE_SQUARE,possible minimap shape,Квадрат,Quadrado,Quadrat,Cuadrada,Carré
Display undiscovered lines,JGPHUD_MINIMAP_DRAWNOTSEEN,DEPRECATED,Показывать ещё не обнаруженные линии,Mostrar linhas não descobertas,Unentdeckte Linien zeichnen,Mostrar lineas no descubiertas,Montrer lignes non découvertes
Undiscovered lines opacity,JGPHUD_MINIMAP_DRAWNOTSEEN_ALPHA,"Replacement for ""Display undiscovered lines"" option: now this is a 0.0-1.0 slider that determines the translucency of the lines that the player hasn't seen yet.",Прозрачность ещё не обнаруженных линий,,,,
Lines around different floor heights,JGPHUD_MINIMAP_DRAWFLOORDIFF,On/off: whether to display lines that are at the edges of the sectors with different floor heights,Линии секторов с разной высотой пола,,,,
Lines around different ceiling heights,JGPHUD_MINIMAP_DRAWCEILINGDIFF,On/off: whether to display lines that are at the edges of the sectors with different ceiling heights,Линии секторов с разной высотой потолка,,,,
Lines,JGPHUD_MINIMAP_COLOR_LINES,color for regular minimap lines,Линии,Linhas,Linien,Lineas,Lignes
Interactive lines,JGPHUD_MINIMAP_COLOR_INTLINES,"color for interactive minimap lines (activateable by pressing Use, but not requiring a key, because locked lines will have a lock color)",Интерактивные линии,Linhas usáveis,Auslöserlinien,Lineas interactivas,Lignes interactives
Cardinal directions display,JGPHUD_MINIMAP_CARDINAL_ENABLE,"Determines whether the cardinal direction letters (N, W, E, S) will be displayed on the minimap.
Possible values: Off / In a circular bounding box / In the minimap's bounding box",Показывать стороны света,,,,
In a circular bounding box,JGPHUD_MINIMAP_CARDINAL_CIRCULAR,"The cardinal direction letters will always rotate along a circle, even if the minimap is set to use the square shape",В круглой рамке,,,,
In the minimap's bounding box,JGPHUD_MINIMAP_CARDINAL_MATCHMAP,"The cardinal direction letters will slide along the minimap's edge, either in a circular or square bounding box, depending on the minimap's shape. This could also be translated as ""Always along the minimap's edge""",Всегда по краю мини-карты,,,,
Cardinal directions' color,JGPHUD_MINIMAP_CARDINAL_COLOR,A color picker that determines the color of the N W E S letters on the minimap,Цвет  сторон света,,,,
Cardinal directions' size,JGPHUD_MINIMAP_CARDINAL_SIZE,"A slider that determines the size of the cardinal direction letters (N, W, E, S) on the minimap.",Размер сторон света,,,,
Monster markers display,JGPHUD_MINIMAP_ENEMIES,"Whether to show enemies on the minimap. Possible options: Only alerted enemies / All enemies
This option becomes available when ""Minimap and enemy radar display"" is set either to ""Enemy markers only"" or ""Minimap and enemy markers""",Отображение маркеров врагов,,,,
Only alerted monsters,JGPHUD_MINIMAP_ENEMIES_ALERTED,"Option for ""Show enemies on the minimap""",Только для активных врагов,,,,
All monsters,JGPHUD_MINIMAP_ENEMIES_ALL,"Option for ""Show enemies on the minimap""",Для всех врагов,,,,
Monster markers shape,JGPHUD_MINIMAP_ENEMIES_SHAPE,An option to choose the shape of enemy markers. Possible values: Arrow / Dot ,Форма маркеров противников,,,,
Arrow,JGPHUD_MINIMAP_ENEMIES_SHAPE_ARROW,"Option for ""Enemy markers shape""",Стрелка,,,,
Dot,JGPHUD_MINIMAP_ENEMIES_SHAPE_DOT,"Option for ""Enemy markers shape""",Точка,,,,
Monster markers size,JGPHUD_MINIMAP_MAPMARKERSCALE,A slider that determines the size of the enemy markers. At 0 (default) the markers are equal to the size of the monster and thus change their visual size according to the minimap's zoom value. At values above 0 they become fixed in size regardless of zoom.,Размер маркеров монстров,,,,
Match the size of the object,JGPHUD_MINIMAP_MAPMARKERSCALE_REAL,"The default value for ""map markers size""",Соответствует размеру объекта,,,,
Map data display,JGPHUD_MAPDATA_TITLE,This is a title for a block of options that determine what kind of extra data about the current map is drawn on the HUD,Данные об уровне,Dados do mapa,Kartendaten,Datos del mapa,Affichage des données de la carte
Show map time,JGPHUD_MAPDATA_TIME,Option in the Map Data options block,Показывать время уровня,Mostrar tempo do mapa,Kartenzeit anzeigen,Mostrar tiempo,Temps de la carte
Show kill count,JGPHUD_MAPDATA_KILLS,Option in the Map Data options block,Показывать убийства,Mostrar contagem de vitimas,Anzahl der Abschüsse anzeigen,Mostrar enemigos muertos,Nombre de morts
Show secrets count,JGPHUD_MAPDATA_SECRETS,Option in the Map Data options block,Показывать секреты,Mostrar contagem de segredos,Anzahl der Geheimnisse anzeigen,Mostrar contador de secretos,Nombre de secrets
Show items count,JGPHUD_MAPDATA_ITEMS,Option in the Map Data options block,Показывать предметы,Mostrar contagem de itens,Anzahl der Gegenstände anzeigen,Mostrar contador de objetos,Nombres d’objets
Crosshair options,JGPHUD_CROSSHAIR_TITLE,Title for various crosshair options,Настройки прицела,Opções de retícula,Fadenkreuzoptionen,Opciones de la mirilla,Options des réticules
Hit markers,JGPHUD_CROSSHAIR_HITMARKERS_TITLE,The title for the menu section,Индикаторы попадания,,,,
Draw enemy hit markers around crosshair,JGPHUD_CROSSHAIR_HITMARKERS,Small angled cross marker around the crosshair when a player's attack hits an enemy.,Индикаторы попадания по врагам вокруг прицела,Mostrar marcadores de acerto ao redor da retícula,Trefferanzeige am Fadenkreuz,Mostrar marcadores de daño contra enemigos,Dessiner les marqueurs de coups de l'ennemi autour du réticule
Hit markers color,JGPHUD_CROSSHAIR_HITMARKERS_COLOR,Color of hit markers,Цвет индикаторов,,,,
Hit markers size,JGPHUD_CROSSHAIR_HITMARKERS_SIZE,"A slider that determines the size of hit markers. At 0 uses ""Relative to crosshair size""",Размер индикаторов,,,,
Relative to crosshair size,JGPHUD_CROSSHAIR_HITMARKERS_SIZE_RELATIVE,"The default option for ""Hit markers size""",Зависит от размера прицела,,,,
Hit markers shape,JGPHUD_CROSSHAIR_HITMARKERS_SHAPE,Option that lets player pick a specific shape for the hitmarkers,Форма индикаторов,,,,
Cross,JGPHUD_CROSSHAIR_HITMARKERS_SHAPE_Cross,A cross shape made out of 4 small pins,Крест,,,,
Angled cross,JGPHUD_CROSSHAIR_HITMARKERS_SHAPE_AngledCross,"Samel as cross, but angled 45 degrees",Наклоненный крест,,,,
4 triangles,JGPHUD_CROSSHAIR_HITMARKERS_SHAPE_Triangles,A cross shame made out of 4 triangles,4 треугольника,,,,
